{"attemptId":"book-025-p0001-a01-attempt-0001","bookId":"book-025","createdAt":"2026-08-15T15:51:42+00:00","executionTrace":{"model":"gpt-5.6-luna","reasoningEffort":"xhigh","system":"codex","taskSourceThreadId":"01a004d4-9af6-7652-bdce-5bc955278230"},"inputImageSha256":"712f21c76b4cd33ae89d825d07a8d48c175528a2493b32e5d866b0e4922db70f","outputSha256":"0550dc48f24d826aeff44d330e81bc2968b8629a12a5d4e38954d5075f1603e3","pageNo":1,"paragraphs":[{"order":1,"rawText":"部编版；快乐读书吧；名著阅读课程化丛书"},{"order":2,"rawText":"四年级"},{"order":3,"rawText":"世界神话传说"},{"order":4,"rawText":"SHIJIE SHENHUA CHUANSHUO"},{"order":5,"rawText":"徐晨◎编"},{"order":6,"rawText":"情境朗读；统编语文教材；配套阅读"},{"order":7,"rawText":"世界各神话体系中的经典故事"},{"order":8,"rawText":"探寻古代文明留下的瑰丽宝藏，了解文化起源时人们的内心世界"}],"promptSha256":"1ed16b2d56b655d94b32b0679d1619c1e9c97ebc9e92c72a639b4e77a6aa5857","promptVersion":"luna-ocr-v2-calibration","schemaVersion":"ocr-page-attempt/v2","sourcePdfSha256":"5c419590e69f1d00d276acd16e157bdb0c8f3e2fc0d25183484cdf65faced6cd","status":"ok","workUnitId":"book-025-p0001-a01"}
